{
  "title": "Préparer l'oral du bac de français",
  "description": "Épreuve anticipée de français (EAF) — oral : 20 min, après 30 min de préparation, coefficient 5. L'examinateur choisit un texte parmi ceux de ton descriptif, puis tu présentes une œuvre lors de l'entretien.",
  "epreuveResume": "1ʳᵉ partie (12 pts) : lecture à voix haute (2) + explication linéaire (8) + question de grammaire (2). 2ᵈᵉ partie (8 pts) : présentation d'une œuvre + entretien.",
  "accent": "emerald"
}
